{
  "league_id": "lg_demo",
  "name": "Sunday Sofa League",
  "scoring_rules_version": "v1",
  "managers": [
    { "id": "mgr_1", "display_name": "Jo", "is_bot": false, "style": "casual", "lang": "en", "favourite_club": "t_hollinsford",
      "squad": ["p_home_9", "p_home_8", "p_away_4", "p_home_1", "p_away_10"], "captain": "p_home_9", "points": 212 },
    { "id": "mgr_2", "display_name": "Priya", "is_bot": true, "style": "analyst", "lang": "en", "favourite_club": "t_saltmere",
      "squad": ["p_away_1", "p_home_10", "p_away_9", "p_home_6", "p_away_3"], "captain": "p_away_1", "points": 218 },
    { "id": "mgr_3", "display_name": "Arjun", "is_bot": true, "style": "casual", "lang": "en", "favourite_club": "t_hollinsford",
      "squad": ["p_home_9", "p_away_8", "p_home_2", "p_away_11", "p_home_1"], "captain": "p_away_8", "points": 205 },
    { "id": "mgr_4", "display_name": "Leo", "is_bot": true, "style": "analyst", "lang": "es", "favourite_club": "t_hollinsford",
      "squad": ["p_home_10", "p_home_7", "p_away_6", "p_home_4"], "captain": "p_home_10", "points": 209 },
    { "id": "mgr_5", "display_name": "Sam", "is_bot": true, "style": "casual", "lang": "en", "favourite_club": "t_saltmere",
      "squad": ["p_away_9", "p_away_7", "p_home_5", "p_home_11", "p_home_6"], "captain": "p_away_9", "points": 199 }
  ]
}
